,videoId,textDisplay,textOriginal,authorDisplayName,authorProfileImageUrl,authorChannelUrl,authorChannelId,canRate,viewerRating,likeCount,publishedAt,updatedAt
27,29WDUQy39GQ,App  hj e pra pegar  as contas  seu não arrumar  cousa  malhor,App  hj e pra pegar  as contas  seu não arrumar  cousa  malhor,Luciano Soares,https://yt3.ggpht.com/a/AATXAJw-ML-1KKBJDbCz_Nt7hp_RL7Jgfo1l52EGmEaQaA=s48-c-k-c0xffffffff-no-rj-mo,http://www.youtube.com/channel/UCIDnzOmE3httZekD6y1eGgg,{'value': 'UCIDnzOmE3httZekD6y1eGgg'},True,none,0,2019-10-05T14:10:33Z,2019-10-05T14:10:33Z
28,29WDUQy39GQ,"Eu tenho um aplicativo onde lanço todos os gastos. O meu lucro líquido gira em torno de 30% dos ganhos. Incluindo gasolina, alimentação,seguro e despesas do carro.","Eu tenho um aplicativo onde lanço todos os gastos. O meu lucro líquido gira em torno de 30% dos ganhos. Incluindo gasolina, alimentação,seguro e despesas do carro.",Sandra Azizah,https://yt3.ggpht.com/a/AATXAJzahKfNbKNkq1qg3GvnEs1OedW5U31KHNLe_3SXVw=s48-c-k-c0xffffffff-no-rj-mo,http://www.youtube.com/channel/UCyfhG8VZiodshb20IgNgR5g,{'value': 'UCyfhG8VZiodshb20IgNgR5g'},True,none,0,2019-10-05T12:19:22Z,2019-10-05T12:19:22Z
29,29WDUQy39GQ,"O lugar que dá mais dinheiro, é aonde os ubers não querem entrar.","O lugar que dá mais dinheiro, é aonde os ubers não querem entrar.",Rafael Carneiro,https://yt3.ggpht.com/a/AATXAJyxgMQ_kb90Dr8aDsus95jo1tzy3fcqXOxR3A=s48-c-k-c0xffffffff-no-rj-mo,http://www.youtube.com/channel/UCmNmCjABniUYClGE1YFJxQw,{'value': 'UCmNmCjABniUYClGE1YFJxQw'},True,none,0,2019-10-05T12:06:29Z,2019-10-05T12:06:29Z
30,29WDUQy39GQ,Depende da cidade !!! cidades pequenas não compensa !!! YouTubers da uber como esse em questão vão falar que ganha 30000 no mês so para enganar priximos desesperados !!!,Depende da cidade !!! cidades pequenas não compensa !!! YouTubers da uber como esse em questão vão falar que ganha 30000 no mês so para enganar priximos desesperados !!!,Mateus Jr,https://yt3.ggpht.com/a/AATXAJyVXY0WUWqJSnGx8hUyl3f_E8U3-b4KT4fx5cTyA8Y=s48-c-k-c0xffffffff-no-rj-mo,http://www.youtube.com/channel/UCSYXNK_KHsjlIeWoIvJQVEw,{'value': 'UCSYXNK_KHsjlIeWoIvJQVEw'},True,none,0,2019-10-05T11:10:16Z,2019-10-05T11:10:16Z
31,29WDUQy39GQ,"Bom dia, Marcelão, tudo bem? Sou Paulo, motorista uber pró diamante, de São José do Rio Preto, assisto sempre os videos de seu canal, veja só o que aconteceu comigo ontem. Um passageiro solicitou corrida, 5 horas da tarde, horário dinâmico, cheguei no local e o pé de rato perguntou se eu esperava ele comprar um salgado eu disse que não porque estava tendo muitas chamadas e meu carro não é lanchonete para ele comer dentro. Sabe o que aconteceu? Ganhei 1 estrela e o fdp reportou mentindo que meu carro estava sujo. O que faço?","Bom dia, Marcelão, tudo bem? Sou Paulo, motorista uber pró diamante, de São José do Rio Preto, assisto sempre os videos de seu canal, veja só o que aconteceu comigo ontem. Um passageiro solicitou corrida, 5 horas da tarde, horário dinâmico, cheguei no local e o pé de rato perguntou se eu esperava ele comprar um salgado eu disse que não porque estava tendo muitas chamadas e meu carro não é lanchonete para ele comer dentro. Sabe o que aconteceu? Ganhei 1 estrela e o fdp reportou mentindo que meu carro estava sujo. O que faço?",Paulo Pires Correia,https://yt3.ggpht.com/a/AATXAJyW23qN8fVpiY81Kwc_xwhddjz9WIGQ8c2dGQ=s48-c-k-c0xffffffff-no-rj-mo,http://www.youtube.com/channel/UCrIMd_ok5yI4EbcZO0rl5_Q,{'value': 'UCrIMd_ok5yI4EbcZO0rl5_Q'},True,none,0,2019-10-05T09:51:28Z,2019-10-05T09:51:28Z
32,29WDUQy39GQ,"Marcelo te acompanho sempre, concordo em partes contigo, mas na real a Uber está estuprando os motoristas . Sem dizer que esse sistema de avaliação te torna refém de passageiro . Esses dias não quis levar uma criança de colo sem cadeirinha  e fui chamado de vagabundo , que era para eu ir para casa dormir . Então , não estaria na hora de fazer um protesto igual os caminhoneiros fizeram e parar geral para a gente fazer uma ferida na pele da Uber ?? Muito legal tuas dicas mas hoje em dia nem com a melhor estratégia do mundo se consegue ganhos excelentes  , meia boca somente . Só se vê os aplicativos enxugando para o nosso lado e querendo mais e mais qualidade da nossa parte sem uma recíproca  . Então  ...que me diz ??","Marcelo te acompanho sempre, concordo em partes contigo, mas na real a Uber está estuprando os motoristas . Sem dizer que esse sistema de avaliação te torna refém de passageiro . Esses dias não quis levar uma criança de colo sem cadeirinha  e fui chamado de vagabundo , que era para eu ir para casa dormir . Então , não estaria na hora de fazer um protesto igual os caminhoneiros fizeram e parar geral para a gente fazer uma ferida na pele da Uber ?? Muito legal tuas dicas mas hoje em dia nem com a melhor estratégia do mundo se consegue ganhos excelentes  , meia boca somente . Só se vê os aplicativos enxugando para o nosso lado e querendo mais e mais qualidade da nossa parte sem uma recíproca  . Então  ...que me diz ??",kikomiuky,https://yt3.ggpht.com/a/AATXAJw5U66KnJ4O2Ps0Prj7PUGZ4hYhlmDpQB6Itg=s48-c-k-c0xffffffff-no-rj-mo,http://www.youtube.com/channel/UC4cfCarE4nsRaPFrBMR134w,{'value': 'UC4cfCarE4nsRaPFrBMR134w'},True,none,1,2019-10-05T09:26:48Z,2019-10-05T09:26:48Z
33,29WDUQy39GQ,"Mano youtuber q ver o seu,so perreco nem assisto mais","Mano youtuber q ver o seu,so perreco nem assisto mais",Thiago melo,https://yt3.ggpht.com/a/AATXAJxEl7982gX_PG0nE0LBm7gvky7H7iNkvi0-LuvNeA=s48-c-k-c0xffffffff-no-rj-mo,http://www.youtube.com/channel/UCFOgv2NmOkmktB0jNvbZeBQ,{'value': 'UCFOgv2NmOkmktB0jNvbZeBQ'},True,none,0,2019-10-05T06:20:26Z,2019-10-05T06:20:26Z
34,29WDUQy39GQ,"Ou vc é burro, ou vc é preguiçoso, esse é o modis operandi desse canal...","Ou vc é burro, ou vc é preguiçoso, esse é o modis operandi desse canal...",gilsontim,https://yt3.ggpht.com/a/AATXAJzvoW3Q2AJ32P9K_DHC9SGHK1oi88b9bd46gC-h=s48-c-k-c0xffffffff-no-rj-mo,http://www.youtube.com/channel/UCbM7trJi0gnR7u2WayqrWwA,{'value': 'UCbM7trJi0gnR7u2WayqrWwA'},True,none,0,2019-10-05T06:07:20Z,2019-10-05T06:07:20Z
35,29WDUQy39GQ,Mostra seus prints de ganhos mais recente!,Mostra seus prints de ganhos mais recente!,Eduardobrito,https://yt3.ggpht.com/a/AATXAJzrHif93dchcHap_Wbc5IGBiiazV6fMgjcIqw=s48-c-k-c0xffffffff-no-rj-mo,http://www.youtube.com/channel/UCugkMtHKkyIPm5GS3KWNTQw,{'value': 'UCugkMtHKkyIPm5GS3KWNTQw'},True,none,0,2019-10-05T03:48:15Z,2019-10-05T03:48:15Z
36,29WDUQy39GQ,"Eu estou trabalhando com aplicativo a 2 meses, a gente faz o nosso horário, mas eu tenho o meu horário fixo, é aquele horário e pronto, as vezes vou dormir mais tarde e a minha esposa fala pra mim: aah amanhã começa mais tarde pra vc descansar e eu falo que não pq tenho aquele horário pra cumprir, mesmo não tendo ninguém pra me cobrar a hora de trabalhar mas eu me cobro, começo todos os dias o mesmo horário e nunca paro o mesmo horário, tenho um horário mínimo pra terminar mas sempre vou além, e acho q assim tá indo bem, alguns fica naquela de não vou agora pq tá calor ou não vou agora pq tô cansado e tals","Eu estou trabalhando com aplicativo a 2 meses, a gente faz o nosso horário, mas eu tenho o meu horário fixo, é aquele horário e pronto, as vezes vou dormir mais tarde e a minha esposa fala pra mim: aah amanhã começa mais tarde pra vc descansar e eu falo que não pq tenho aquele horário pra cumprir, mesmo não tendo ninguém pra me cobrar a hora de trabalhar mas eu me cobro, começo todos os dias o mesmo horário e nunca paro o mesmo horário, tenho um horário mínimo pra terminar mas sempre vou além, e acho q assim tá indo bem, alguns fica naquela de não vou agora pq tá calor ou não vou agora pq tô cansado e tals",Jonathan Hermann,https://yt3.ggpht.com/a/AATXAJy-2duISosuLEylUy58HJ2StkP8gOXj3GZTXmpNHw=s48-c-k-c0xffffffff-no-rj-mo,http://www.youtube.com/channel/UCwPZOlg3HdZEzUd7ZC7Ee8Q,{'value': 'UCwPZOlg3HdZEzUd7ZC7Ee8Q'},True,none,1,2019-10-05T02:51:19Z,2019-10-05T02:51:19Z
37,29WDUQy39GQ,Uma dica trabalhem sempre no navegador Waze..busca sempre o caminho mais longo.. aumentando à tarifa..,Uma dica trabalhem sempre no navegador Waze..busca sempre o caminho mais longo.. aumentando à tarifa..,David capuz vídeos aleatórias,https://yt3.ggpht.com/a/AATXAJz8m7jbJF8KeNJmvei-06uWOQmVXyeiPUgqi6s2TPA=s48-c-k-c0xffffffff-no-rj-mo,http://www.youtube.com/channel/UCiLFXrh5VfkSZMh3Yu8VQvQ,{'value': 'UCiLFXrh5VfkSZMh3Yu8VQvQ'},True,none,4,2019-10-05T02:48:27Z,2019-10-05T02:48:27Z
38,29WDUQy39GQ,Hoje fiz 400 gastei 100 de gasolina mais 45 reais dá diária do carro.. 250 reais de lucro.. trabalhei 14 horas,Hoje fiz 400 gastei 100 de gasolina mais 45 reais dá diária do carro.. 250 reais de lucro.. trabalhei 14 horas,David capuz vídeos aleatórias,https://yt3.ggpht.com/a/AATXAJz8m7jbJF8KeNJmvei-06uWOQmVXyeiPUgqi6s2TPA=s48-c-k-c0xffffffff-no-rj-mo,http://www.youtube.com/channel/UCiLFXrh5VfkSZMh3Yu8VQvQ,{'value': 'UCiLFXrh5VfkSZMh3Yu8VQvQ'},True,none,1,2019-10-05T02:43:02Z,2019-10-05T02:43:02Z
39,29WDUQy39GQ,"Eu uso o aplicativo da uber para ganhar um ganho extra, digamos assim eu faço bico, mas não pretendo sair do meu serviço para trabalhar só na uber, mas depende muito do  salário de cada um. Eu desejo boas corridas a todos os motoristas da uber e bons ganhos e que Deus abençoe todos  nois, um abraço e ótimos vídeos vlw","Eu uso o aplicativo da uber para ganhar um ganho extra, digamos assim eu faço bico, mas não pretendo sair do meu serviço para trabalhar só na uber, mas depende muito do  salário de cada um. Eu desejo boas corridas a todos os motoristas da uber e bons ganhos e que Deus abençoe todos  nois, um abraço e ótimos vídeos vlw",vladimir gass,https://yt3.ggpht.com/a/AATXAJxmp14CRftgSzMlhmYs3wWhoGqvaVLeH2prlNIgbw=s48-c-k-c0xffffffff-no-rj-mo,http://www.youtube.com/channel/UCt4eUlRZgto_ftolbme7b4A,{'value': 'UCt4eUlRZgto_ftolbme7b4A'},True,none,7,2019-10-05T02:26:52Z,2019-10-05T02:26:52Z
40,29WDUQy39GQ,Esse cara aí é um fanfarrão da uberlixo... Daqui a pouco ele pedi pra sair... Cara vê se te enxerga... Vc &quot;foi&quot; o melhor motorista do país com a Uber... Seu reinado acabou...15 minutos de fama.,"Esse cara aí é um fanfarrão da uberlixo... Daqui a pouco ele pedi pra sair... Cara vê se te enxerga... Vc ""foi"" o melhor motorista do país com a Uber... Seu reinado acabou...15 minutos de fama.",Jader Marcel,https://yt3.ggpht.com/a/AATXAJwrvJ4tqyFh-2NIqnQHCgMNDT8Fx07CwwWfIMUmMG8=s48-c-k-c0xffffffff-no-rj-mo,http://www.youtube.com/channel/UCd3pUqQnCZ4HXVANbAvB3Hw,{'value': 'UCd3pUqQnCZ4HXVANbAvB3Hw'},True,none,0,2019-10-05T00:50:55Z,2019-10-05T00:51:20Z
41,29WDUQy39GQ,Boa noite senhor  Marcelo em primeiro lugar gostaria de parabenizar  pelo seus pronunciamentos  e ajuda aos motoristas de app. Mas só tenho uma divergência de opinião.  Já fui  empresario no ramo de transportes de cargas.  O que tenho a lhe dizer que nós motoristas não temos um negócio; mas sim parte dele pois as decisões de ajustes de tarifas e e soluções de problemas decorrentes de divergências de ideias e atitudes entre passageiros e motoristas.É uma decisão unilateral e nenhum momento os motoristas tem poder de decisão.  Por esse motivo não considero que temos um  negocio.,Boa noite senhor  Marcelo em primeiro lugar gostaria de parabenizar  pelo seus pronunciamentos  e ajuda aos motoristas de app. Mas só tenho uma divergência de opinião.  Já fui  empresario no ramo de transportes de cargas.  O que tenho a lhe dizer que nós motoristas não temos um negócio; mas sim parte dele pois as decisões de ajustes de tarifas e e soluções de problemas decorrentes de divergências de ideias e atitudes entre passageiros e motoristas.É uma decisão unilateral e nenhum momento os motoristas tem poder de decisão.  Por esse motivo não considero que temos um  negocio.,Ernani Dantas,https://yt3.ggpht.com/a/AATXAJwP2QZvHCM8rRW_drUeGu2xLXkKsJGYGMwE8A=s48-c-k-c0xffffffff-no-rj-mo,http://www.youtube.com/channel/UCR6Nu4TJhZUol6XaIfuaOAA,{'value': 'UCR6Nu4TJhZUol6XaIfuaOAA'},True,none,15,2019-10-05T00:39:19Z,2019-10-05T00:39:19Z
42,29WDUQy39GQ,Melhor vídeo!,Melhor vídeo!,Cristian Rizzo,https://yt3.ggpht.com/a/AATXAJz9I049hgvkI0-AgtIrJ4ZXNiohM5dlU35Cm2T1Lw=s48-c-k-c0xffffffff-no-rj-mo,http://www.youtube.com/channel/UC40IRgSr8kb8CqNDnbUwpmQ,{'value': 'UC40IRgSr8kb8CqNDnbUwpmQ'},True,none,0,2019-10-05T00:34:17Z,2019-10-05T00:34:17Z
43,29WDUQy39GQ,Qui no RJ. Ta gostozim no azeite,Qui no RJ. Ta gostozim no azeite,Marcelocarlos Carlos,https://yt3.ggpht.com/a/AATXAJx8zh14qNHwIt6PmW0en_LuYGc8MgkzW2XB9Q=s48-c-k-c0xffffffff-no-rj-mo,http://www.youtube.com/channel/UC8XETf4SaW7sEspS7o-nM4g,{'value': 'UC8XETf4SaW7sEspS7o-nM4g'},True,none,0,2019-10-05T00:14:57Z,2019-10-05T00:14:57Z
44,29WDUQy39GQ,"Lá fui eu ver a planilha pr entender,quando fui abrir entendi que é  um meio de vc ganhar dinheiro,achei que seria pra ajudar nos motoristas,desculpas se interpretei errado mais foi isto que entedi","Lá fui eu ver a planilha pr entender,quando fui abrir entendi que é  um meio de vc ganhar dinheiro,achei que seria pra ajudar nos motoristas,desculpas se interpretei errado mais foi isto que entedi",Marcio Alves,https://yt3.ggpht.com/a/AATXAJzdjE_QlimyBczt8qLJiybg5NvmApcq8AjnQg=s48-c-k-c0xffffffff-no-rj-mo,http://www.youtube.com/channel/UC8GTUTsR2cz7JsmNzUWkgLA,{'value': 'UC8GTUTsR2cz7JsmNzUWkgLA'},True,none,0,2019-10-04T23:57:43Z,2019-10-04T23:57:43Z
45,29WDUQy39GQ,"brabo esses tumbnails ai ou nome do video como se fosse dizer, &quot;ain a os aplicativos não prestam&quot; ai vc vai ver o video e é a mesma historia de sempre, marketing da planilha do fulaninho,<br />eu to fazendo apenas 200 por dia com 50 de gasolina em 6 horas em porto alegre, no maximo 7 horas, todos os dias da semana, isso ja supri meus gastos tranquilamente, enfim mais um vídeo que não condiz com o conteudo, muito me ajudou seus vídeos mas de uns tempos pra cá esses nomes estao sendo apelativos","brabo esses tumbnails ai ou nome do video como se fosse dizer, ""ain a os aplicativos não prestam"" ai vc vai ver o video e é a mesma historia de sempre, marketing da planilha do fulaninho,
eu to fazendo apenas 200 por dia com 50 de gasolina em 6 horas em porto alegre, no maximo 7 horas, todos os dias da semana, isso ja supri meus gastos tranquilamente, enfim mais um vídeo que não condiz com o conteudo, muito me ajudou seus vídeos mas de uns tempos pra cá esses nomes estao sendo apelativos",ArtikGames,https://yt3.ggpht.com/a/AATXAJwKvL8CDRxxsYVnRODpHwoH7Fn7p0qfGjvChxFPFg=s48-c-k-c0xffffffff-no-rj-mo,http://www.youtube.com/channel/UC5BEYSQOMQohvdEmZfi10xA,{'value': 'UC5BEYSQOMQohvdEmZfi10xA'},True,none,12,2019-10-04T23:52:00Z,2019-10-04T23:52:00Z
46,29WDUQy39GQ,Fala meu querido boas dicas tenho 3 anos de uber até aqui não tenho que reclamar graças a deus mudei minhas rotinas mais deu certo,Fala meu querido boas dicas tenho 3 anos de uber até aqui não tenho que reclamar graças a deus mudei minhas rotinas mais deu certo,Uber do Izaías Zé Gatão,https://yt3.ggpht.com/a/AATXAJxkqItbd5OQcZr3vbt93_mVzzsKv74f9zj_PHTvbw=s48-c-k-c0xffffffff-no-rj-mo,http://www.youtube.com/channel/UCdvKrR8JGtqiNxwA10_AQYw,{'value': 'UCdvKrR8JGtqiNxwA10_AQYw'},True,none,1,2019-10-04T22:19:41Z,2019-10-04T22:19:41Z
47,29WDUQy39GQ,"Uber é pura sorte, teve vezes de acordar <a href=""https://www.youtube.com/watch?v=29WDUQy39GQ&amp;t=04m00s"">04:00</a> da manhã quando dava <a href=""https://www.youtube.com/watch?v=29WDUQy39GQ&amp;t=10m00s"">10:00</a> tinha feito 95 reais em São Paulo e em outros casos tive sorte e fiz 400 reais no dia. Ou seja minha contas ela chegam e não depende da sorte. Graças a deus abri uma empresa e presto serviço de engenharia. App é passado, hoje sou passageiro.","Uber é pura sorte, teve vezes de acordar 04:00 da manhã quando dava 10:00 tinha feito 95 reais em São Paulo e em outros casos tive sorte e fiz 400 reais no dia. Ou seja minha contas ela chegam e não depende da sorte. Graças a deus abri uma empresa e presto serviço de engenharia. App é passado, hoje sou passageiro.",Daniel Gouveia,https://yt3.ggpht.com/a/AATXAJy_-Mg2pcck1EI_HYMOYaTwFo_pFud7sSWNVcdgDw=s48-c-k-c0xffffffff-no-rj-mo,http://www.youtube.com/channel/UCGwF9micN2L4vAWOCBiip_w,{'value': 'UCGwF9micN2L4vAWOCBiip_w'},True,none,8,2019-10-04T22:12:43Z,2019-10-04T22:12:43Z
48,29WDUQy39GQ,"Aplicativo é Boom, para Cliente. Vire Cliente e não Motorista 👍😎","Aplicativo é Boom, para Cliente. Vire Cliente e não Motorista 👍😎",Claudio Filho,https://yt3.ggpht.com/a/AATXAJxQjTA3XIcYR3A1mi7zg71ly_Zro3W51WSC7icugA=s48-c-k-c0xffffffff-no-rj-mo,http://www.youtube.com/channel/UCNip8oiPve-lYPAoXF4wMMQ,{'value': 'UCNip8oiPve-lYPAoXF4wMMQ'},True,none,7,2019-10-04T19:01:40Z,2019-10-04T19:01:40Z
49,29WDUQy39GQ,"opa Marcelo, te acompanho no canal, sou novo como motorista uber tenho 1 mês e 900 viagens, sou de cascavel Paraná, tem algum vídeo seu dando dicas sobre a taxa de aceitação, pois aqui aparece muitas corridas de 10km 8km do passageiro dificultando deixar a média acima dos 80%","opa Marcelo, te acompanho no canal, sou novo como motorista uber tenho 1 mês e 900 viagens, sou de cascavel Paraná, tem algum vídeo seu dando dicas sobre a taxa de aceitação, pois aqui aparece muitas corridas de 10km 8km do passageiro dificultando deixar a média acima dos 80%",Wellington M Costa,https://yt3.ggpht.com/a/AATXAJyzE7edZhZfHXVCXFSTlBrtpQInfJ1lrG6mFzp7=s48-c-k-c0xffffffff-no-rj-mo,http://www.youtube.com/channel/UCx9wVcUuq40Bq2hKIpNmfjw,{'value': 'UCx9wVcUuq40Bq2hKIpNmfjw'},True,none,0,2019-10-04T17:37:16Z,2019-10-04T17:37:16Z
50,29WDUQy39GQ,"Hoje em dia não tem mais esse negócio de estratégia.E pura sorte,sai de casa no horário que todos falam que é morto(10 as 13) fiz 150 <a href=""http://reais.no/"">reais.No</a> outro dia sai 4 da manhã até as 9 fiz só 58 reais.","Hoje em dia não tem mais esse negócio de estratégia.E pura sorte,sai de casa no horário que todos falam que é morto(10 as 13) fiz 150 reais.No outro dia sai 4 da manhã até as 9 fiz só 58 reais.",Giselle Alves,https://yt3.ggpht.com/a/AATXAJylofN8q1lV70eZNiP8C6p5J-PSxdo41uoQ-g=s48-c-k-c0xffffffff-no-rj-mo,http://www.youtube.com/channel/UCBPQQ-ljgKy9BkpqUahXtaA,{'value': 'UCBPQQ-ljgKy9BkpqUahXtaA'},True,none,9,2019-10-04T16:45:30Z,2019-10-04T16:45:30Z
51,29WDUQy39GQ,Planejamento é super importante mesmo. Muito top Marcelo!,Planejamento é super importante mesmo. Muito top Marcelo!,Thalles Martins,https://yt3.ggpht.com/a/AATXAJxX7Sj1-pBxNmJ_OIjnmf_bXd2NQoQVs8JuRm4=s48-c-k-c0xffffffff-no-rj-mo,http://www.youtube.com/channel/UCdCBlRYC3HJDLBo7BTKqYEw,{'value': 'UCdCBlRYC3HJDLBo7BTKqYEw'},True,none,0,2019-10-04T16:12:51Z,2019-10-04T16:12:51Z
52,29WDUQy39GQ,mais um vídeo de bla bla bla pra ganhar visualização! tá chato já,mais um vídeo de bla bla bla pra ganhar visualização! tá chato já,Daniel Moreira,https://yt3.ggpht.com/a/AATXAJx_J3Ih3ircvU0KBch_7LDES9gCRz86bz4_PQ=s48-c-k-c0xffffffff-no-rj-mo,http://www.youtube.com/channel/UCVatrrshO7-5zIa5CE02Jcw,{'value': 'UCVatrrshO7-5zIa5CE02Jcw'},True,none,27,2019-10-04T16:12:33Z,2019-10-04T16:12:33Z
53,29WDUQy39GQ,"O que adianta calcular Marcelo, se o cara vai tem outra saída ou outro emprego.","O que adianta calcular Marcelo, se o cara vai tem outra saída ou outro emprego.",Warley Goncalves,https://yt3.ggpht.com/a/AATXAJwEMsIfW8YzmaNVsmp4w5-bANBwfLIuDW02Zn5O=s48-c-k-c0xffffffff-no-rj-mo,http://www.youtube.com/channel/UCOomPJj31Ypszj_SPOPlQoQ,{'value': 'UCOomPJj31Ypszj_SPOPlQoQ'},True,none,1,2019-10-04T16:04:35Z,2019-10-04T16:04:35Z
54,29WDUQy39GQ,"Verdade, chorão é o que mais tem. Acham que é só pegar o carro e sair, estou a 20 dias, tenho minha meta diária, e bato todos os dias como o carro tem limite de km, tenho que bater minha meta dentro deste padrão, cansativo mas possível só organizar.","Verdade, chorão é o que mais tem. Acham que é só pegar o carro e sair, estou a 20 dias, tenho minha meta diária, e bato todos os dias como o carro tem limite de km, tenho que bater minha meta dentro deste padrão, cansativo mas possível só organizar.",Josias Chagas,https://yt3.ggpht.com/a/AATXAJxXWEpV1TScv8o2wGQLb0xbf_W7rseMr4B13SdFXg=s48-c-k-c0xffffffff-no-rj-mo,http://www.youtube.com/channel/UCL5F_ZQcpP0WW9B1BjuFYGA,{'value': 'UCL5F_ZQcpP0WW9B1BjuFYGA'},True,none,0,2019-10-04T15:29:08Z,2019-10-04T15:29:08Z
55,29WDUQy39GQ,A verdade que quando vc vê alguém reclamando que app não da pra fazer um salário razoável o cara é burro ou preguiçoso ou os dois juntos!,A verdade que quando vc vê alguém reclamando que app não da pra fazer um salário razoável o cara é burro ou preguiçoso ou os dois juntos!,Marco Túlio Pires Carneiro,https://yt3.ggpht.com/a/AATXAJwInTSjNrCfC7Tb3s-RntX0-GZZ3bWbLJOdNv_y=s48-c-k-c0xffffffff-no-rj-mo,http://www.youtube.com/channel/UCBXHkvEONlluvbZPSRCazpA,{'value': 'UCBXHkvEONlluvbZPSRCazpA'},True,none,4,2019-10-04T15:03:01Z,2019-10-04T15:03:01Z
56,29WDUQy39GQ,"Estratégia os aplicativos bota a corrida por 4,50 que estratégia você vai ter em cima de um valor tão baixo que não paga nem gasolina","Estratégia os aplicativos bota a corrida por 4,50 que estratégia você vai ter em cima de um valor tão baixo que não paga nem gasolina",anderson neto,https://yt3.ggpht.com/a/AATXAJx7cnYnBz2MPsoa8DWxUS_B9O143cS2TG50iY1Bpw=s48-c-k-c0xffffffff-no-rj-mo,http://www.youtube.com/channel/UC0jDmruNPOmll6w_8GThycA,{'value': 'UC0jDmruNPOmll6w_8GThycA'},True,none,0,2019-10-04T14:12:01Z,2019-10-04T14:12:01Z
57,29WDUQy39GQ,"Todo esse bla bla bla pra fazer propaganda de planilha? Fala pra nós, quanto ganhou pra fazer esse merchan?","Todo esse bla bla bla pra fazer propaganda de planilha? Fala pra nós, quanto ganhou pra fazer esse merchan?",DE BOLSA CHEIA,https://yt3.ggpht.com/a/AATXAJzOikYvZRlKKUZ82Q2D9Q5fKvgGE1EpSiQxkw=s48-c-k-c0xffffffff-no-rj-mo,http://www.youtube.com/channel/UCTQ5tj2SSQTRLCKDWu1ejzg,{'value': 'UCTQ5tj2SSQTRLCKDWu1ejzg'},True,none,3,2019-10-04T13:48:10Z,2019-10-04T13:48:10Z
58,29WDUQy39GQ,"Se tu aluga carro, paga aluguel e volta pra casa com dinheiro tá paga a conta ;)","Se tu aluga carro, paga aluguel e volta pra casa com dinheiro tá paga a conta ;)",Tiaguinho,https://yt3.ggpht.com/a/AATXAJzRGOKcANOlDhQua25ySFoPf8b98gZ5Bbqp0f-exH8=s48-c-k-c0xffffffff-no-rj-mo,http://www.youtube.com/channel/UCiZTYSnahFBVbpsUWr2KSBg,{'value': 'UCiZTYSnahFBVbpsUWr2KSBg'},True,none,3,2019-10-04T13:40:03Z,2019-10-04T13:40:03Z
59,29WDUQy39GQ,"Você ama o uber até o dia que um bêbado desmancha seu carro e foge, você não tem noção do tamanho  que é esse prejuízo.","Você ama o uber até o dia que um bêbado desmancha seu carro e foge, você não tem noção do tamanho  que é esse prejuízo.",Alex Tavares,https://yt3.ggpht.com/a/AATXAJwtMbxYoX-l3q7LXemHcWeN2ucxJ1S-KXYkzA=s48-c-k-c0xffffffff-no-rj-mo,http://www.youtube.com/channel/UCuGPsn55IJpgdVZb4OcHivg,{'value': 'UCuGPsn55IJpgdVZb4OcHivg'},True,none,0,2019-10-04T13:07:53Z,2019-10-04T13:07:53Z
60,29WDUQy39GQ,eu não tenho planilha mas sei que estou no lucro ja falei antes la no começo eu trabalhava com um carro emprestado de um amigo pois estava desempregado e menos de 3 meses paguei as contas e comprei o meu e nunca saquei o dinheiro que entra no cartão kkk  acho que sou o maior motorista  acionista da uber e não sei quando vou sacar eu não tenho conta bancaria e nem tempo para abrir uma no momento só trabalhar sei que esta em boas maus,eu não tenho planilha mas sei que estou no lucro ja falei antes la no começo eu trabalhava com um carro emprestado de um amigo pois estava desempregado e menos de 3 meses paguei as contas e comprei o meu e nunca saquei o dinheiro que entra no cartão kkk  acho que sou o maior motorista  acionista da uber e não sei quando vou sacar eu não tenho conta bancaria e nem tempo para abrir uma no momento só trabalhar sei que esta em boas maus,irineu de souza da silva,https://yt3.ggpht.com/a/AATXAJxB9Z3pgjKDvD64v8S7ocI_VzAmoMQmg1KW8Vgdqg=s48-c-k-c0xffffffff-no-rj-mo,http://www.youtube.com/channel/UC9ngsL2LaB1u784iYM-7ruA,{'value': 'UC9ngsL2LaB1u784iYM-7ruA'},True,none,2,2019-10-04T12:57:28Z,2019-10-04T12:57:28Z
61,29WDUQy39GQ,Os aplicativos são ótimos...para os passageiros...simples assim!,Os aplicativos são ótimos...para os passageiros...simples assim!,Rogério Guglielmetti,https://yt3.ggpht.com/a/AATXAJxJXPUTnEbtZr1wOUhSKBnoC7a_IAkXOh_9aQ=s48-c-k-c0xffffffff-no-rj-mo,http://www.youtube.com/channel/UCl7ASjlj3NeD5a6CcM-JplQ,{'value': 'UCl7ASjlj3NeD5a6CcM-JplQ'},True,none,43,2019-10-04T12:44:32Z,2019-10-04T12:44:32Z
62,29WDUQy39GQ,"Marcelo 99% dos motoristas não fazem controle de &quot;nada&quot;. Não controla km, não controla receita, não controla despesa, não faz relação km X receita. Não tem estratégia, pensa que é só ligar os apps e sair recebendo chamadas. Não tem disciplina, não persevera. Você está certinho, trabalhar com apps é como jogar xadrez. Trabalhei por 15 anos em banco na área comercial, onde meta, meta, meta e resultado é cobrado manhã, tarde e noite.","Marcelo 99% dos motoristas não fazem controle de ""nada"". Não controla km, não controla receita, não controla despesa, não faz relação km X receita. Não tem estratégia, pensa que é só ligar os apps e sair recebendo chamadas. Não tem disciplina, não persevera. Você está certinho, trabalhar com apps é como jogar xadrez. Trabalhei por 15 anos em banco na área comercial, onde meta, meta, meta e resultado é cobrado manhã, tarde e noite.",Djalma Gonçalves,https://yt3.ggpht.com/a/AATXAJx16eyzWV7hFLIMT_MP7QWPiOmnuFTSfb47QYigSw=s48-c-k-c0xffffffff-no-rj-mo,http://www.youtube.com/channel/UC_efqwiTige9y_AjoORQbOg,{'value': 'UC_efqwiTige9y_AjoORQbOg'},True,none,3,2019-10-04T12:42:49Z,2019-10-04T12:42:49Z
